Sheet: P HE8,10,12_Cengiz
I1: looks weird, ok | N1: bad electrode out | Q1: true 0 | Z1: used for Figures
B2: Heart Interneurons | K2: HE(8) | Y2: HE(12)
G3: median | H3: 1st/last spike | J3: duty cycle | K3: IPSC strength [nS] | P3: relative strength of IPSCs [ % of total] | X3: duty cycle | Y3: IPSC strength [nS] | AC3: relative strength of IPSCs [ % of total]
B4: HN phases | G4: Peristaltic
B5: HN4 | C5: HN3 | D5: HN6 | E5: HN7 | G5: HE(8) phase | K5: HN3 | L5: HN4 | M5: HN6 | N5: HN7 | O5: SUM | P5: HN3 | Q5: HN4 | R5: HN6 | S5: HN7 | U5: HE(12) phase | Y5: HN3 | Z5: HN4 | AA5: HN6 | AB5: HN7 | AC5: SUM | AD5: HN3 | AE5: HN4 | AF5: HN6 | AG5: HN7
A6: May22B | B6: 0 | C6: of:=1-0.0078 -> 0.9922 | D6: 0.846 | E6: 0.809 | G6: 0.429 | H6: 0.0418 | I6: 0.797 | J6: of:=[.I6]-[.H6] -> 0.7552 | K6: 12.5285714285714 | L6: 7.85485714285714 | M6: 16.9697142857143 | N6: 11.8851428571429 | O6: of:=SUM([.K6:.N6]) -> 49.2382857142857 | P6: of:=[.K6]/[.$O6] -> 0.254447758422598 | Q6: of:=[.L6]/[.$O6] -> 0.159527429294277 | R6: of:=[.M6]/[.$O6] -> 0.344644701567886 | S6: of:=[.N6]/[.$O6] -> 0.241380110715239 | T6: 1 | U6: 0.324 | V6: of:=-0.0119 -> -0.0119 | W6: 0.686 | X6: of:=[.W6]-[.V6] -> 0.6979 | Y6: 6.15314285714286 | Z6: 6.21142857142857 | AA6: 12.0222857142857 | AB6: 12.9782857142857 | AC6: of:=SUM([.Y6:.AB6]) -> 37.3651428571428 | AD6: of:=[.Y6]/[.$AC6] -> 0.164676015843643 | AE6: of:=[.Z6]/[.$AC6] -> 0.166235911238893 | AF6: of:=[.AA6]/[.$AC6] -> 0.321751364908471 | AG6: of:=[.AB6]/[.$AC6] -> 0.347336708008992
A7: May20B | B7: 0 | C7: 0.99434 | D7: 0.862 | E7: 0.798 | G7: 0.468 | H7: 0.151 | I7: 0.807 | J7: of:=[.I7]-[.H7] -> 0.656 | K7: 3.6488 | L7: 4.68102857142857 | M7: 4.12262857142857 | N7: 2.94577142857143 | O7: of:=SUM([.K7:.N7]) -> 15.3982285714286 | P7: of:=[.K7]/[.$O7] -> 0.236962322196616 | Q7: of:=[.L7]/[.$O7] -> 0.303997862462844 | R7: of:=[.M7]/[.$O7] -> 0.267733950844067 | S7: of:=[.N7]/[.$O7] -> 0.191305864496473 | T7: 2 | U7: 0.371 | V7: 0.0223 | W7: 0.824 | X7: of:=[.W7]-[.V7] -> 0.8017 | Y7: 2.4788 | Z7: 2.42714285714286 | AA7: 4.93971428571428 | AB7: 12.1502857142857 | AC7: of:=SUM([.Y7:.AB7]) -> 21.9959428571429 | AD7: of:=[.Y7]/[.$AC7] -> 0.112693509712181 | AE7: of:=[.Z7]/[.$AC7] -> 0.110345024666887 | AF7: of:=[.AA7]/[.$AC7] -> 0.224573882456245 | AG7: of:=[.AB7]/[.$AC7] -> 0.552387583164687
A8: May20A | B8: 0 | C8: 1.213 | D8: 0.86 | E8: 0.807 | G8: 0.502 | H8: 0.246 | I8: 0.773 | J8: of:=[.I8]-[.H8] -> 0.527 | K8: 2.76074285714286 | L8: 11.352 | M8: 8.29085714285714 | N8: 4.35742857142857 | O8: of:=SUM([.K8:.N8]) -> 26.7610285714286 | P8: of:=[.K8]/[.$O8] -> 0.10316280817735 | Q8: of:=[.L8]/[.$O8] -> 0.424198941744712 | R8: of:=[.M8]/[.$O8] -> 0.309810855017317 | S8: of:=[.N8]/[.$O8] -> 0.162827395060621 | T8: 3 | U8: 0.368 | V8: 0.123 | W8: 0.611 | X8: of:=[.W8]-[.V8] -> 0.488 | Y8: 0 | Z8: 2.29171428571429 | AA8: 7.48342857142857 | AB8: 8.55428571428571 | AC8: of:=SUM([.Y8:.AB8]) -> 18.3294285714286 | AD8: of:=[.Y8]/[.$AC8] -> 0 | AE8: of:=[.Z8]/[.$AC8] -> 0.125029227004193 | AF8: of:=[.AA8]/[.$AC8] -> 0.408273970040372 | AG8: of:=[.AB8]/[.$AC8] -> 0.466696802955435
A9: May19B | B9: 0 | C9: 1.114 | D9: 0.856 | E9: 0.9292 | G9: 0.556 | H9: 0.375 | I9: 0.711 | J9: of:=[.I9]-[.H9] -> 0.336 | K9: 3.51988571428571 | L9: 7.02914285714286 | M9: 6.22457142857143 | N9: 5.77428571428571 | O9: of:=SUM([.K9:.N9]) -> 22.5478857142857 | P9: of:=[.K9]/[.$O9] -> 0.156107129461616 | Q9: of:=[.L9]/[.$O9] -> 0.311742881182398 | R9: of:=[.M9]/[.$O9] -> 0.276060093059089 | S9: of:=[.N9]/[.$O9] -> 0.256089896296897 | T9: 4 | U9: 0.475 | V9: 0.234 | W9: 0.686 | X9: of:=[.W9]-[.V9] -> 0.452 | Y9: 1.14285714285714 | Z9: 4.61908571428571 | AA9: 7.39714285714286 | AB9: 16.972 | AC9: of:=SUM([.Y9:.AB9]) -> 30.1310857142857 | AD9: of:=[.Y9]/[.$AC9] -> 0.0379295042234503 | AE9: of:=[.Z9]/[.$AC9] -> 0.153299677219919 | AF9: of:=[.AA9]/[.$AC9] -> 0.245498716086282 | AG9: of:=[.AB9]/[.$AC9] -> 0.563272102470349
A10: May19A | B10: 0 | C10: 1.0734 | D10: 0.9246 | E10: 0.876 | G10: 0.494 | H10: 0.161 | I10: 0.826 | J10: of:=[.I10]-[.H10] -> 0.665 | K10: 3.57314285714286 | L10: 6.26742857142857 | M10: 4.41554285714286 | N10: 3.6564 | O10: of:=SUM([.K10:.N10]) -> 17.9125142857143 | P10: of:=[.K10]/[.$O10] -> 0.199477460291129 | Q10: of:=[.L10]/[.$O10] -> 0.349891057807949 | R10: of:=[.M10]/[.$O10] -> 0.246506034089495 | S10: of:=[.N10]/[.$O10] -> 0.204125447811426 | T10: 5 | U10: 0.425 | V10: 0.0629 | W10: 0.796 | X10: of:=[.W10]-[.V10] -> 0.7331 | Y10: 1.97428571428571 | Z10: 2.17714285714286 | AA10: 3.46617142857143 | AB10: 3.97422857142857 | AC10: of:=SUM([.Y10:.AB10]) -> 11.5918285714286 | AD10: of:=[.Y10]/[.$AC10] -> 0.170317021350015 | AE10: of:=[.Z10]/[.$AC10] -> 0.187817033673967 | AF10: of:=[.AA10]/[.$AC10] -> 0.299018520435578 | AG10: of:=[.AB10]/[.$AC10] -> 0.34284742454044
A11: May18A | B11: 0 | C11: 0.9661 | D11: 0.859 | E11: 0.764 | G11: 0.518 | H11: 0.29 | I11: 0.728 | J11: of:=[.I11]-[.H11] -> 0.438 | K11: 4.16308571428571 | L11: 4.1624 | M11: 3.27771428571429 | N11: 4.13845714285714 | O11: of:=SUM([.K11:.N11]) -> 15.7416571428571 | P11: of:=[.K11]/[.$O11] -> 0.264462989919377 | Q11: of:=[.L11]/[.$O11] -> 0.264419429430192 | R11: of:=[.M11]/[.$O11] -> 0.208219138300923 | S11: of:=[.N11]/[.$O11] -> 0.262898442349508 | T11: 6 | U11: 0.334 | V11: 0.0416 | W11: 0.64 | X11: of:=[.W11]-[.V11] -> 0.5984 | Y11: 2.62891428571429 | Z11: 3.00388571428571 | AA11: 4.89582857142857 | AB11: 9.86628571428571 | AC11: of:=SUM([.Y11:.AB11]) -> 20.3949142857143 | AD11: of:=[.Y11]/[.$AC11] -> 0.12890048219304 | AE11: of:=[.Z11]/[.$AC11] -> 0.147286018082939 | AF11: of:=[.AA11]/[.$AC11] -> 0.240051441395754 | AG11: of:=[.AB11]/[.$AC11] -> 0.483762058328267
A12: May15 | B12: 0 | C12: 0.99493 | D12: 0.884 | E12: 0.876 | G12: 0.508 | H12: 0.31 | I12: 0.751 | J12: of:=[.I12]-[.H12] -> 0.441 | K12: 9.11371428571428 | L12: 11.5257142857143 | M12: 6.14 | N12: 6.22057142857143 | O12: of:=SUM([.K12:.N12]) -> 33 | P12: of:=[.K12]/[.$O12] -> 0.27617316017316 | Q12: of:=[.L12]/[.$O12] -> 0.349264069264069 | R12: of:=[.M12]/[.$O12] -> 0.186060606060606 | S12: of:=[.N12]/[.$O12] -> 0.188502164502165 | T12: 7 | U12: 0.44 | V12: 0.157 | W12: 0.741 | X12: of:=[.W12]-[.V12] -> 0.584 | Y12: 1.48194285714286 | Z12: 2.08308571428571 | AA12: 4.09817142857143 | AB12: 4.67788571428571 | AC12: of:=SUM([.Y12:.AB12]) -> 12.3410857142857 | AD12: of:=[.Y12]/[.$AC12] -> 0.120082048812561 | AE12: of:=[.Z12]/[.$AC12] -> 0.168792743402988 | AF12: of:=[.AA12]/[.$AC12] -> 0.332075436752497 | AG12: of:=[.AB12]/[.$AC12] -> 0.379049771031954
A13: May14 | B13: 0 | C13: 1.0466 | D13: 0.863 | E13: 0.777 | G13: 0.528 | H13: 0.335 | I13: 0.824 | J13: of:=[.I13]-[.H13] -> 0.489 | K13: 4.95634285714286 | L13: 1.20891428571429 | M13: 5.96571428571429 | N13: 3.90925714285714 | O13: of:=SUM([.K13:.N13]) -> 16.0402285714286 | P13: of:=[.K13]/[.$O13] -> 0.308994528043776 | Q13: of:=[.L13]/[.$O13] -> 0.0753676470588235 | R13: of:=[.M13]/[.$O13] -> 0.371922024623803 | S13: of:=[.N13]/[.$O13] -> 0.243715800273598 | T13: 8 | U13: 0.358 | V13: of:=-1+0.9 -> -0.1 | W13: 0.707 | X13: of:=[.W13]-[.V13] -> 0.807 | Y13: 1.2352 | Z13: 1.57542857142857 | AA13: 4.70548571428571 | AB13: 6.53085714285714 | AC13: of:=SUM([.Y13:.AB13]) -> 14.0469714285714 | AD13: of:=[.Y13]/[.$AC13] -> 0.0879335454109071 | AE13: of:=[.Z13]/[.$AC13] -> 0.112154323046757 | AF13: of:=[.AA13]/[.$AC13] -> 0.334982222909259 | AG13: of:=[.AB13]/[.$AC13] -> 0.464929908633076
A14: May11 | B14: 0 | C14: 0.951 | D14: 0.853 | E14: 0.772 | G14: 0.516 | H14: 0.25 | I14: 0.761 | J14: of:=[.I14]-[.H14] -> 0.511 | K14: 8.88342857142857 | L14: 12.432 | M14: 5.00142857142857 | N14: 2.97657142857143 | O14: of:=SUM([.K14:.N14]) -> 29.2934285714286 | P14: of:=[.K14]/[.$O14] -> 0.303256703112351 | Q14: of:=[.L14]/[.$O14] -> 0.424395525081198 | R14: of:=[.M14]/[.$O14] -> 0.170735513572035 | S14: of:=[.N14]/[.$O14] -> 0.101612258234416 | T14: 9 | U14: 0.408 | V14: 0.187 | W14: 0.606 | X14: of:=[.W14]-[.V14] -> 0.419 | Y14: 2.87428571428571 | Z14: 3.73234285714286 | AA14: 7.54457142857143 | AB14: 6.52171428571428 | AC14: of:=SUM([.Y14:.AB14]) -> 20.6729142857143 | AD14: of:=[.Y14]/[.$AC14] -> 0.139036309760736 | AE14: of:=[.Z14]/[.$AC14] -> 0.180542656229269 | AF14: of:=[.AA14]/[.$AC14] -> 0.364949582061828 | AG14: of:=[.AB14]/[.$AC14] -> 0.315471451948167
A15: May26A | B15: 0 | C15: 1.0222 | D15: 0.826 | E15: 0.672 | G15: 0.406 | H15: 0.0295 | I15: 0.822 | J15: of:=[.I15]-[.H15] -> 0.7925 | K15: 2.66514285714286 | L15: 3.2688 | M15: 6.31028571428571 | N15: 3.1408 | O15: of:=SUM([.K15:.N15]) -> 15.3850285714286 | P15: of:=[.K15]/[.$O15] -> 0.173229633261278 | Q15: of:=[.L15]/[.$O15] -> 0.212466293762396 | R15: of:=[.M15]/[.$O15] -> 0.410157555768502 | S15: of:=[.N15]/[.$O15] -> 0.204146517207824 | T15: 10 | U15: 0.261 | V15: of:=-1+0.894 -> -0.106 | W15: 0.554 | X15: of:=[.W15]-[.V15] -> 0.66 | Y15: 0.869085714285714 | Z15: 0.673885714285714 | AA15: 4.33914285714286 | AB15: 4.66165714285714 | AC15: of:=SUM([.Y15:.AB15]) -> 10.5437714285714 | AD15: of:=[.Y15]/[.$AC15] -> 0.0824264562422771 | AE15: of:=[.Z15]/[.$AC15] -> 0.063913156582627 | AF15: of:=[.AA15]/[.$AC15] -> 0.41153612694834 | AG15: of:=[.AB15]/[.$AC15] -> 0.442124260226755
A16: May27B | B16: 0 | C16: 1.069 | D16: 0.873 | E16: 0.865 | G16: 0.567 | H16: 0.358 | I16: 0.8 | J16: of:=[.I16]-[.H16] -> 0.442 | K16: 6.20057142857143 | L16: 8.22285714285714 | M16: 5.88 | N16: 5.38182857142857 | O16: 25.6852571428571 | P16: 0.24140585371931 | Q16: 0.320139179340233 | R16: 0.228925097665809 | S16: 0.209529869274648 | T16: 11 | U16: 0.39 | V16: 0.21 | W16: 0.567 | X16: of:=[.W16]-[.V16] -> 0.357 | Y16: 1.73034285714286 | Z16: 3.41748571428571 | AA16: 4.67274285714286 | AB16: 12.2714285714286 | AC16: 22.092 | AD16: of:=[.Y16]/[.$AC16] -> 0.0783244096117534 | AE16: of:=[.Z16]/[.$AC16] -> 0.154693360233827 | AF16: of:=[.AA16]/[.$AC16] -> 0.211512894131036 | AG16: of:=[.AB16]/[.$AC16] -> 0.555469336023383
A17: June1B | B17: 0 | C17: 0.146 | D17: 0.895 | E17: 0.808 | G17: 0.518 | H17: 0.343 | I17: 0.706 | J17: of:=[.I17]-[.H17] -> 0.363 | K17: 3.47742857142857 | L17: 5.19731428571429 | M17: 5.76628571428571 | N17: 3.27428571428571 | O17: of:=SUM([.K17:.N17]) -> 17.7153142857143 | P17: of:=[.K17]/[.$O17] -> 0.196295053835584 | Q17: of:=[.L17]/[.$O17] -> 0.293379739240947 | R17: of:=[.M17]/[.$O17] -> 0.325497229193144 | S17: of:=[.N17]/[.$O17] -> 0.184827977730325 | T17: 12 | U17: 0.425 | V17: 0.21 | W17: 0.612 | X17: of:=[.W17]-[.V17] -> 0.402 | Y17: 1.09925714285714 | Z17: 2.30457142857143 | AA17: 3.11965714285714 | AB17: 7.70857142857143 | AC17: of:=SUM([.Y17:.AB17]) -> 14.2320571428571 | AD17: of:=[.Y17]/[.$AC17] -> 0.0772381063273656 | AE17: of:=[.Z17]/[.$AC17] -> 0.161928202327944 | AF17: of:=[.AA17]/[.$AC17] -> 0.219199312618194 | AG17: of:=[.AB17]/[.$AC17] -> 0.541634378726497
A18: STD | G18: of:=STDEV([.G6:.G17]) -> 0.0470103147933483 | H18: of:=STDEV([.H6:.H17]) -> 0.119493495131693 | I18: of:=STDEV([.I6:.I17]) -> 0.0438831091962189 | J18: of:=STDEV([.J6:.J17]) -> 0.149291888949335 | U18: of:=STDEV([.U6:.U17]) -> 0.0585047913085809 | V18: of:=STDEV([.V6:.V17]) -> 0.119420457551536 | W18: of:=STDEV([.W6:.W17]) -> 0.0865561649853417 | X18: of:=STDEV([.X6:.X17]) -> 0.158636940890675
A20: May20B | C20: new, exciting synaptic strength | K20: 4.69 | L20: 5.92 | M20: 5.49 | N20: 2.35 | O20: of:=SUM([.K20:.N20]) -> 18.45 | P20: of:=[.K20]/[.$O20] -> 0.25420054200542 | Q20: of:=[.L20]/[.$O20] -> 0.320867208672087 | R20: of:=[.M20]/[.$O20] -> 0.297560975609756 | S20: of:=[.N20]/[.$O20] -> 0.127371273712737 | T20: 2 | Y20: 2.06 | Z20: 2.85 | AA20: 7.01 | AB20: 16.49 | AC20: of:=SUM([.Y20:.AB20]) -> 28.41 | AD20: of:=[.Y20]/[.$AC20] -> 0.0725096796902499 | AE20: of:=[.Z20]/[.$AC20] -> 0.100316789862724 | AF20: of:=[.AA20]/[.$AC20] -> 0.246744104188666 | AG20: of:=[.AB20]/[.$AC20] -> 0.58042942625836
A21: May22B | C21: new, exciting synaptic strength | K21: 15.31 | L21: 7.21 | M21: 21.94 | N21: 12.69 | O21: of:=SUM([.K21:.N21]) -> 57.15 | P21: of:=[.K21]/[.$O21] -> 0.267891513560805 | Q21: of:=[.L21]/[.$O21] -> 0.126159230096238 | R21: of:=[.M21]/[.$O21] -> 0.383902012248469 | S21: of:=[.N21]/[.$O21] -> 0.222047244094488 | Y21: 5.27 | Z21: 5.94 | AA21: 14.69 | AB21: 16.23 | AC21: of:=SUM([.Y21:.AB21]) -> 42.13 | AD21: of:=[.Y21]/[.$AC21] -> 0.125089010206504 | AE21: of:=[.Z21]/[.$AC21] -> 0.140992167101828 | AF21: of:=[.AA21]/[.$AC21] -> 0.348682648943746 | AG21: of:=[.AB21]/[.$AC21] -> 0.385236173747923
A23: May20B | C23: change from original | K23: of:=[.K20]/[.K7] -> 1.28535408901557 | L23: of:=[.L20]/[.L7] -> 1.2646793134598 | M23: of:=[.M20]/[.M7] -> 1.33167465971779 | N23: of:=[.N20]/[.N7] -> 0.797753680820935 | P23: of:=[.P20]/[.P7] -> 1.0727466698039 | Q23: of:=[.Q20]/[.Q7] -> 1.05549166060766 | R23: of:=[.R20]/[.R7] -> 1.11140546304141 | S23: of:=[.S20]/[.S7] -> 0.665799106828142 | Y23: of:=[.Y20]/[.Y7] -> 0.831047280942392 | Z23: of:=[.Z20]/[.Z7] -> 1.17422012948793 | AA23: of:=[.AA20]/[.AA7] -> 1.41911041702817 | AB23: of:=[.AB20]/[.AB7] -> 1.3571697314584 | AD23: of:=[.AD20]/[.AD7] -> 0.64342374175265 | AE23: of:=[.AE20]/[.AE7] -> 0.909119284404206 | AF23: of:=[.AF20]/[.AF7] -> 1.09872128267961 | AG23: of:=[.AG20]/[.AG7] -> 1.05076479621974
A24: May22B | C24: change from original | K24: of:=[.K21]/[.K6] -> 1.22200684150513 | L24: of:=[.L21]/[.L6] -> 0.917903390077113 | M24: of:=[.M21]/[.M6] -> 1.29289153786578 | N24: of:=[.N21]/[.N6] -> 1.06771960190394 | P24: of:=[.P21]/[.P6] -> 1.05283503074088 | Q24: of:=[.Q21]/[.Q6] -> 0.790830960257714 | R24: of:=[.R21]/[.R6] -> 1.11390661310617 | S24: of:=[.S21]/[.S6] -> 0.919906961002441 | Y24: of:=[.Y21]/[.Y6] -> 0.856472882615156 | Z24: of:=[.Z21]/[.Z6] -> 0.956301747930083 | AA24: of:=[.AA21]/[.AA6] -> 1.22189742858501 | AB24: of:=[.AB21]/[.AB6] -> 1.25055036984854 | AD24: of:=[.AD21]/[.AD6] -> 0.759606731834423 | AE24: of:=[.AE21]/[.AE6] -> 0.848145061142724 | AF24: of:=[.AF21]/[.AF6] -> 1.08370215940789 | AG24: of:=[.AG21]/[.AG6] -> 1.10911448420231
A27: May22B [nA] | K27: of:=[.K21]*((-45+62.5)/1000) -> 0.267925 | Y27: of:=[.Y21]*((-45+62.5)/1000) -> 0.092225

Sheet: S HE8,10,12_Cengiz
I1: looks weird, ok | N1: bad electrode out | Q1: true 0 | Z1: used for Figures
B2: Heart Interneurons | K2: HE(8) | U2: HE(12)
G3: median | H3: 1st/last spike | J3: duty cycle | K3: IPSC strength [nS] | O3: relative strength of IPSCs [ % of total] | U3: IPSC strength [nS] | X3: duty cycle | Z3: relative strength of IPSCs [ % of total]
B4: HN phases | G4: Synchronous | K4: beware: reverse order of HN3 and HN4 | U4: beware: reverse order of HN3 and HN4
B5: HN4 | C5: HN3 | D5: HN6 | E5: HN7 | G5: HE(8) phase | K5: HN3 | L5: HN4 | M5: HN6 | N5: HN7 | O5: SUM | P5: HN3 | Q5: HN4 | R5: HN6 | S5: HN7 | U5: HE(12) phase | Y5: HN3 | Z5: HN4 | AA5: HN6 | AB5: HN7 | AC5: SUM | AD5: HN3 | AE5: HN4 | AF5: HN6 | AG5: HN7
A6: May22B | B6: 0.0116 | C6: 0.025 | D6: 0.0591 | E6: 0.104 | G6: 0.464 | H6: 0.13 | I6: 0.823 | J6: of:=[.I6]-[.H6] -> 0.693 | K6: 12.5285714285714 | L6: 7.85485714285714 | M6: 16.9697142857143 | N6: 11.8851428571429 | O6: of:=SUM([.K6:.N6]) -> 49.2382857142857 | P6: of:=[.K6]/[.$O6] -> 0.254447758422598 | Q6: of:=[.L6]/[.$O6] -> 0.159527429294277 | R6: of:=[.M6]/[.$O6] -> 0.344644701567886 | S6: of:=[.N6]/[.$O6] -> 0.241380110715239 | T6: 1 | U6: 0.467 | V6: 0.0434 | W6: 0.891 | X6: of:=[.W6]-[.V6] -> 0.8476 | Y6: 6.15314285714286 | Z6: 6.21142857142857 | AA6: 12.0222857142857 | AB6: 12.9782857142857 | AC6: of:=SUM([.Y6:.AB6]) -> 37.3651428571428 | AD6: of:=[.Y6]/[.$AC6] -> 0.164676015843643 | AE6: of:=[.Z6]/[.$AC6] -> 0.166235911238893 | AF6: of:=[.AA6]/[.$AC6] -> 0.321751364908471 | AG6: of:=[.AB6]/[.$AC6] -> 0.347336708008992
A7: May20B | B7: 0.0116 | C7: -0.025 | D7: 0.0486 | E7: 0.0886 | G7: 0.458 | H7: 0.131 | I7: 0.8 | J7: of:=[.I7]-[.H7] -> 0.669 | K7: 3.6488 | L7: 4.68102857142857 | M7: 4.12262857142857 | N7: 2.94577142857143 | O7: of:=SUM([.K7:.N7]) -> 15.3982285714286 | P7: of:=[.K7]/[.$O7] -> 0.236962322196616 | Q7: of:=[.L7]/[.$O7] -> 0.303997862462844 | R7: of:=[.M7]/[.$O7] -> 0.267733950844067 | S7: of:=[.N7]/[.$O7] -> 0.191305864496473 | T7: 2 | U7: 0.478 | V7: 0.089 | W7: 0.856 | X7: of:=[.W7]-[.V7] -> 0.767 | Y7: 2.4788 | Z7: 2.42714285714286 | AA7: 4.93971428571428 | AB7: 12.1502857142857 | AC7: of:=SUM([.Y7:.AB7]) -> 21.9959428571429 | AD7: of:=[.Y7]/[.$AC7] -> 0.112693509712181 | AE7: of:=[.Z7]/[.$AC7] -> 0.110345024666887 | AF7: of:=[.AA7]/[.$AC7] -> 0.224573882456245 | AG7: of:=[.AB7]/[.$AC7] -> 0.552387583164687
A8: May20A | B8: 0.0116 | C8: 0.21 | D8: 0.0091 | E8: 0.0372 | G8: 0.562 | H8: 0.305 | I8: 0.826 | J8: of:=[.I8]-[.H8] -> 0.521 | K8: 2.76074285714286 | L8: 11.352 | M8: 8.29085714285714 | N8: 4.35742857142857 | O8: of:=SUM([.K8:.N8]) -> 26.7610285714286 | P8: of:=[.K8]/[.$O8] -> 0.10316280817735 | Q8: of:=[.L8]/[.$O8] -> 0.424198941744712 | R8: of:=[.M8]/[.$O8] -> 0.309810855017317 | S8: of:=[.N8]/[.$O8] -> 0.162827395060621 | T8: 3 | U8: 0.518 | V8: 0.267 | W8: 0.801 | X8: of:=[.W8]-[.V8] -> 0.534 | Y8: 0 | Z8: 2.29171428571429 | AA8: 7.48342857142857 | AB8: 8.55428571428571 | AC8: of:=SUM([.Y8:.AB8]) -> 18.3294285714286 | AD8: of:=[.Y8]/[.$AC8] -> 0 | AE8: of:=[.Z8]/[.$AC8] -> 0.125029227004193 | AF8: of:=[.AA8]/[.$AC8] -> 0.408273970040372 | AG8: of:=[.AB8]/[.$AC8] -> 0.466696802955435
A9: May19B | B9: 0.0116 | C9: 0.127 | D9: 0.0607 | E9: 0.121 | G9: 0.587 | H9: 0.385 | I9: 0.821 | J9: of:=[.I9]-[.H9] -> 0.436 | K9: 3.51988571428571 | L9: 7.02914285714286 | M9: 6.22457142857143 | N9: 5.77428571428571 | O9: of:=SUM([.K9:.N9]) -> 22.5478857142857 | P9: of:=[.K9]/[.$O9] -> 0.156107129461616 | Q9: of:=[.L9]/[.$O9] -> 0.311742881182398 | R9: of:=[.M9]/[.$O9] -> 0.276060093059089 | S9: of:=[.N9]/[.$O9] -> 0.256089896296897 | T9: 4 | U9: 0.653 | V9: 0.398 | W9: 0.86 | X9: of:=[.W9]-[.V9] -> 0.462 | Y9: 1.14285714285714 | Z9: 4.61908571428571 | AA9: 7.39714285714286 | AB9: 16.972 | AC9: of:=SUM([.Y9:.AB9]) -> 30.1310857142857 | AD9: of:=[.Y9]/[.$AC9] -> 0.0379295042234503 | AE9: of:=[.Z9]/[.$AC9] -> 0.153299677219919 | AF9: of:=[.AA9]/[.$AC9] -> 0.245498716086282 | AG9: of:=[.AB9]/[.$AC9] -> 0.563272102470349
A10: May19A | B10: 0.0116 | C10: 0.106 | D10: 0.0734 | E10: 0.1 | G10: 0.535 | H10: 0.237 | I10: 0.826 | J10: of:=[.I10]-[.H10] -> 0.589 | K10: 3.57314285714286 | L10: 6.26742857142857 | M10: 4.41554285714286 | N10: 3.6564 | O10: of:=SUM([.K10:.N10]) -> 17.9125142857143 | P10: of:=[.K10]/[.$O10] -> 0.199477460291129 | Q10: of:=[.L10]/[.$O10] -> 0.349891057807949 | R10: of:=[.M10]/[.$O10] -> 0.246506034089495 | S10: of:=[.N10]/[.$O10] -> 0.204125447811426 | T10: 5 | U10: 0.59 | V10: 0.276 | W10: 0.864 | X10: of:=[.W10]-[.V10] -> 0.588 | Y10: 1.97428571428571 | Z10: 2.17714285714286 | AA10: 3.46617142857143 | AB10: 3.97422857142857 | AC10: of:=SUM([.Y10:.AB10]) -> 11.5918285714286 | AD10: of:=[.Y10]/[.$AC10] -> 0.170317021350015 | AE10: of:=[.Z10]/[.$AC10] -> 0.187817033673967 | AF10: of:=[.AA10]/[.$AC10] -> 0.299018520435578 | AG10: of:=[.AB10]/[.$AC10] -> 0.34284742454044
A11: May18A | B11: 0.0116 | C11: 0.0146 | D11: 0.0498 | E11: 0.0664 | G11: 0.581 | H11: 0.349 | I11: 0.799 | J11: of:=[.I11]-[.H11] -> 0.45 | K11: 4.16308571428571 | L11: 4.1624 | M11: 3.27771428571429 | N11: 4.13845714285714 | O11: of:=SUM([.K11:.N11]) -> 15.7416571428571 | P11: of:=[.K11]/[.$O11] -> 0.264462989919377 | Q11: of:=[.L11]/[.$O11] -> 0.264419429430192 | R11: of:=[.M11]/[.$O11] -> 0.208219138300923 | S11: of:=[.N11]/[.$O11] -> 0.262898442349508 | T11: 6 | U11: 0.543 | V11: 0.317 | W11: 0.827 | X11: of:=[.W11]-[.V11] -> 0.51 | Y11: 2.62891428571429 | Z11: 3.00388571428571 | AA11: 4.89582857142857 | AB11: 9.86628571428571 | AC11: of:=SUM([.Y11:.AB11]) -> 20.3949142857143 | AD11: of:=[.Y11]/[.$AC11] -> 0.12890048219304 | AE11: of:=[.Z11]/[.$AC11] -> 0.147286018082939 | AF11: of:=[.AA11]/[.$AC11] -> 0.240051441395754 | AG11: of:=[.AB11]/[.$AC11] -> 0.483762058328267
A12: May15 | B12: 0.0116 | C12: 0.0078 | D12: 0.0323 | E12: 0.0422 | G12: 0.48 | H12: 0.303 | I12: 0.748 | J12: of:=[.I12]-[.H12] -> 0.445 | K12: 9.11371428571428 | L12: 11.5257142857143 | M12: 6.14 | N12: 6.22057142857143 | O12: of:=SUM([.K12:.N12]) -> 33 | P12: of:=[.K12]/[.$O12] -> 0.27617316017316 | Q12: of:=[.L12]/[.$O12] -> 0.349264069264069 | R12: of:=[.M12]/[.$O12] -> 0.186060606060606 | S12: of:=[.N12]/[.$O12] -> 0.188502164502165 | T12: 7 | U12: 0.532 | V12: 0.297 | W12: 0.819 | X12: of:=[.W12]-[.V12] -> 0.522 | Y12: 1.48194285714286 | Z12: 2.08308571428571 | AA12: 4.09817142857143 | AB12: 4.67788571428571 | AC12: of:=SUM([.Y12:.AB12]) -> 12.3410857142857 | AD12: of:=[.Y12]/[.$AC12] -> 0.120082048812561 | AE12: of:=[.Z12]/[.$AC12] -> 0.168792743402988 | AF12: of:=[.AA12]/[.$AC12] -> 0.332075436752497 | AG12: of:=[.AB12]/[.$AC12] -> 0.379049771031954
A13: May14 | B13: 0.0116 | C13: 0.0281 | D13: 0.098 | E13: 0.115 | G13: 0.523 | H13: 0.323 | I13: 0.81 | J13: of:=[.I13]-[.H13] -> 0.487 | K13: 4.95634285714286 | L13: 1.20891428571429 | M13: 5.96571428571429 | N13: 3.90925714285714 | O13: of:=SUM([.K13:.N13]) -> 16.0402285714286 | P13: of:=[.K13]/[.$O13] -> 0.308994528043776 | Q13: of:=[.L13]/[.$O13] -> 0.0753676470588235 | R13: of:=[.M13]/[.$O13] -> 0.371922024623803 | S13: of:=[.N13]/[.$O13] -> 0.243715800273598 | T13: 8 | U13: 0.566 | V13: 0.205 | W13: 0.9304 | X13: of:=[.W13]-[.V13] -> 0.7254 | Y13: 1.2352 | Z13: 1.57542857142857 | AA13: 4.70548571428571 | AB13: 6.53085714285714 | AC13: of:=SUM([.Y13:.AB13]) -> 14.0469714285714 | AD13: of:=[.Y13]/[.$AC13] -> 0.0879335454109071 | AE13: of:=[.Z13]/[.$AC13] -> 0.112154323046757 | AF13: of:=[.AA13]/[.$AC13] -> 0.334982222909259 | AG13: of:=[.AB13]/[.$AC13] -> 0.464929908633076
A14: May11ratio | B14: 0.0116 | C14: 0.0116 | D14: 0.03 | E14: 0.0575 | G14: 0.542 | H14: 0.256 | I14: 0.811 | J14: of:=[.I14]-[.H14] -> 0.555 | K14: 8.88342857142857 | L14: 12.432 | M14: 5.00142857142857 | N14: 2.97657142857143 | O14: of:=SUM([.K14:.N14]) -> 29.2934285714286 | P14: of:=[.K14]/[.$O14] -> 0.303256703112351 | Q14: of:=[.L14]/[.$O14] -> 0.424395525081198 | R14: of:=[.M14]/[.$O14] -> 0.170735513572035 | S14: of:=[.N14]/[.$O14] -> 0.101612258234416 | T14: 9 | U14: 0.564 | V14: 0.316 | W14: 0.826 | X14: of:=[.W14]-[.V14] -> 0.51 | Y14: 2.87428571428571 | Z14: 3.73234285714286 | AA14: 7.54457142857143 | AB14: 6.52171428571428 | AC14: of:=SUM([.Y14:.AB14]) -> 20.6729142857143 | AD14: of:=[.Y14]/[.$AC14] -> 0.139036309760736 | AE14: of:=[.Z14]/[.$AC14] -> 0.180542656229269 | AF14: of:=[.AA14]/[.$AC14] -> 0.364949582061828 | AG14: of:=[.AB14]/[.$AC14] -> 0.315471451948167
A15: May26A | B15: 0 | C15: 0.0324 | D15: 0.0616 | E15: 0.0896 | G15: 0.456 | H15: of:=1-0.892 -> 0.108 | I15: 0.82 | J15: of:=[.I15]-[.H15] -> 0.712 | K15: 2.66514285714286 | L15: 3.2688 | M15: 6.31028571428571 | N15: 3.1408 | O15: of:=SUM([.K15:.N15]) -> 15.3850285714286 | P15: of:=[.K15]/[.$O15] -> 0.173229633261278 | Q15: of:=[.L15]/[.$O15] -> 0.212466293762396 | R15: of:=[.M15]/[.$O15] -> 0.410157555768502 | S15: of:=[.N15]/[.$O15] -> 0.204146517207824 | T15: 10 | U15: 0.549 | V15: of:=1-0.839 -> 0.161 | W15: 0.873 | X15: of:=[.W15]-[.V15] -> 0.712 | Y15: 0.869085714285714 | Z15: 0.673885714285714 | AA15: 4.33914285714286 | AB15: 4.66165714285714 | AC15: of:=SUM([.Y15:.AB15]) -> 10.5437714285714 | AD15: of:=[.Y15]/[.$AC15] -> 0.0824264562422771 | AE15: of:=[.Z15]/[.$AC15] -> 0.063913156582627 | AF15: of:=[.AA15]/[.$AC15] -> 0.41153612694834 | AG15: of:=[.AB15]/[.$AC15] -> 0.442124260226755
A16: May27B | B16: 0 | C16: 0.0627 | D16: 0.108 | E16: 0.109 | G16: 0.565 | H16: 0.348 | I16: 0.822 | J16: of:=[.I16]-[.H16] -> 0.474 | K16: 6.20057142857143 | L16: 8.22285714285714 | M16: 5.88 | N16: 5.38182857142857 | O16: of:=SUM([.K16:.N16]) -> 25.6852571428571 | P16: of:=[.K16]/[.$O16] -> 0.24140585371931 | Q16: of:=[.L16]/[.$O16] -> 0.320139179340233 | R16: of:=[.M16]/[.$O16] -> 0.228925097665809 | S16: of:=[.N16]/[.$O16] -> 0.209529869274648 | T16: 11 | U16: 0.597 | V16: 0.39 | W16: 0.838 | X16: of:=[.W16]-[.V16] -> 0.448 | Y16: 1.73034285714286 | Z16: 3.41748571428571 | AA16: 4.67274285714286 | AB16: 12.2714285714286 | AC16: of:=SUM([.Y16:.AB16]) -> 22.092 | AD16: of:=[.Y16]/[.$AC16] -> 0.0783244096117534 | AE16: of:=[.Z16]/[.$AC16] -> 0.154693360233827 | AF16: of:=[.AA16]/[.$AC16] -> 0.211512894131036 | AG16: of:=[.AB16]/[.$AC16] -> 0.555469336023383
A17: June1B | B17: 0 | C17: 0.122 | D17: 0.0134 | E17: 0.0707 | G17: 0.552 | H17: 0.351 | I17: 0.812 | J17: of:=[.I17]-[.H17] -> 0.461 | K17: 3.47742857142857 | L17: 5.19731428571429 | M17: 5.76628571428571 | N17: 3.27428571428571 | O17: of:=SUM([.K17:.N17]) -> 17.7153142857143 | P17: of:=[.K17]/[.$O17] -> 0.196295053835584 | Q17: of:=[.L17]/[.$O17] -> 0.293379739240947 | R17: of:=[.M17]/[.$O17] -> 0.325497229193144 | S17: of:=[.N17]/[.$O17] -> 0.184827977730325 | T17: 12 | U17: 0.558 | V17: 0.318 | W17: 0.812 | X17: of:=[.W17]-[.V17] -> 0.494 | Y17: 1.09925714285714 | Z17: 2.30457142857143 | AA17: 3.11965714285714 | AB17: 7.70857142857143 | AC17: of:=SUM([.Y17:.AB17]) -> 14.2320571428571 | AD17: of:=[.Y17]/[.$AC17] -> 0.0772381063273656 | AE17: of:=[.Z17]/[.$AC17] -> 0.161928202327944 | AF17: of:=[.AA17]/[.$AC17] -> 0.219199312618194 | AG17: of:=[.AB17]/[.$AC17] -> 0.541634378726497
G18: of:=STDEV([.G6:.G17]) -> 0.0486778992848693 | H18: of:=STDEV([.H6:.H17]) -> 0.097079005626002 | I18: of:=STDEV([.I6:.I17]) -> 0.0215652638764427 | J18: of:=STDEV([.J6:.J17]) -> 0.101782298871839 | U18: of:=STDEV([.U6:.U17]) -> 0.0507992931232137 | V18: of:=STDEV([.V6:.V17]) -> 0.111272936348586 | W18: of:=STDEV([.W6:.W17]) -> 0.0370019614549709 | X18: of:=STDEV([.X6:.X17]) -> 0.133858333073938
I19: sum: | J19: of:=[.H18]+[.I18] -> 0.118644269502445 | X19: of:=[.V18]+[.W18] -> 0.148274897803556
I20: sqrt of squared sums | J20: of:=SQRT([.H18]^2+[.I18]^2) -> 0.0994454319684617 | X20: of:=SQRT([.V18]^2+[.W18]^2) -> 0.117263854256764